<?xml version="1.0" encoding="UTF-8"?>
<!DOCTYPE services SYSTEM "services.dtd">
<services>
    <service id="40292">
            <vehicleID>2019</vehicleID>
            <mechanicID>40391</mechanicID>
            <serviceDescription>
                Regular minor service maintenance. New front and rear disk breaks also needed.
            </serviceDescription>
            <serviceType>Minor Service</serviceType>
            <partsNeeded>
                <part id="6582092" quantity="2" />
                <part id="1492666" />
            </partsNeeded>
        </service>
        <service id="402918">
            <vehicleID>13984</vehicleID>
            <mechanicID>40393</mechanicID>
            <serviceDescription>
                Regular major service at 150,000 km. Drivers complaining of vehicle pulling
                to the left at higher speeds. Check as part of major service
            </serviceDescription>
            <serviceType>Major Service</serviceType>
        </service>
        <service id="30291">
            <vehicleID>1246</vehicleID>
            <mechanicID>24829</mechanicID>
            <serviceDescription>
                New air and fuel filters need to be fitted as well as major service
            </serviceDescription>
            <serviceType>Minor Service</serviceType>
            <partsNeeded>
                <part id="1492666" quantity="3" />
                <part id="1701812" />
            </partsNeeded>
        </service>
    </services>